{
  "last_updated": "2026-05-02T04:39:54.504257+00:00",
  "scan_version": "2.1.0",
  "scanner": "agent-readiness",
  "scanner_version": "1.1.0",
  "rules_pack_version": null,
  "checks_count": null,
  "total_repos": 30,
  "repos": [
    {
      "repo": "huggingface/accelerate",
      "name": "accelerate",
      "owner": "huggingface",
      "description": "\ud83d\ude80 A simple way to launch, train, and use PyTorch models on almost any device and distributed configuration, automatic mixed precision (including fp8), and easy-to-configure FSDP and DeepSpeed support",
      "stars": 9650,
      "forks": 1341,
      "language": "Python",
      "url": "https://github.com/huggingface/accelerate",
      "avatar": "https://avatars.githubusercontent.com/u/25720743?v=4",
      "topics": [],
      "overall_score": 94.5,
      "grade": "S",
      "pillars": {
        "cognitive_load": 85.1,
        "feedback": 99.5,
        "flow": 97.2,
        "safety": 98.7
      },
      "top_findings": [
        {
          "pillar": "cognitive_load",
          "check_id": "repo_shape.large_files",
          "message": "21 findings \u2014 e.g. Large file: docs/source/usage_guides/megatron_lm.md (611 lines > 500); Large file: docs/source/usage_guides/deepspeed.md (745 lines > 500)",
          "severity": "warn",
          "fix_hint": "Split the file into smaller modules grouped by concept, or add an\nexclusion in `.agent-readiness.toml` if the file is truly intentional\n(large generated tables, etc.).\n",
          "count": 21
        },
        {
          "pillar": "cognitive_load",
          "check_id": "git.churn_hotspots",
          "message": "5 findings \u2014 e.g. Hotspot: src/accelerate/accelerator.py changed 417 times and is >200 lines.; Hotspot: src/accelerate/commands/launch.py changed 190 times and is >200 lines.",
          "severity": "warn",
          "fix_hint": "For each hotspot, identify the dominant axes of change (e.g. one\nfile holds both API routing and validation logic) and split along\nthose lines. After the split, both halves see lower per-file churn.\n",
          "count": 5
        },
        {
          "pillar": "cognitive_load",
          "check_id": "agent_docs.canonical",
          "message": "None of these expected paths exist: AGENTS.md",
          "severity": "warn",
          "fix_hint": "Add an AGENTS.md to the repo root with: canonical commands\n(install/test/lint/run), a do-not-touch list, and commit conventions.\nSee agent-readiness/AGENTS.md for an example.\n",
          "count": 1
        },
        {
          "pillar": "cognitive_load",
          "check_id": "repo_shape.token_budget",
          "message": "Estimated orientation cost is ~57,208 tokens \u2014 may exceed agent context window.",
          "severity": "warn",
          "fix_hint": "Trim AGENTS.md / README to the essentials and split monolithic\nmodules so the largest representative source file is < 500 lines.\nThe orientation budget is fixed; the only variable is how much\nsignal you fit into it.\n",
          "count": 1
        },
        {
          "pillar": "flow",
          "check_id": "env.example_parity",
          "message": "Env var usage found in source files but none of .env.example, .env.sample, .env.template, config/.env.example, deploy/.env.example, docker/.env.example, infra/.env.example, env/.env.example, envs/.env.example present.",
          "severity": "warn",
          "fix_hint": "Add a `.env.example` file at the repo root listing each env var\nyour code reads, with empty values or example placeholders. Add\na README sentence telling agents to `cp .env.example .env` before\nrunning.\n",
          "count": 1
        }
      ],
      "scanned_at": "2026-05-02T04:40:16.968000+00:00",
      "rank": 1
    },
    {
      "repo": "guardrails-ai/guardrails",
      "name": "guardrails",
      "owner": "guardrails-ai",
      "description": "Adding guardrails to large language models.",
      "stars": 6804,
      "forks": 590,
      "language": "Python",
      "url": "https://github.com/guardrails-ai/guardrails",
      "avatar": "https://avatars.githubusercontent.com/u/140440022?v=4",
      "topics": [
        "ai",
        "foundation-model",
        "gpt-3",
        "llm",
        "openai"
      ],
      "overall_score": 94.2,
      "grade": "S",
      "pillars": {
        "cognitive_load": 85.1,
        "feedback": 98.1,
        "flow": 97.9,
        "safety": 98.7
      },
      "top_findings": [
        {
          "pillar": "cognitive_load",
          "check_id": "repo_shape.large_files",
          "message": "11 findings \u2014 e.g. Large file: guardrails/validator_base.py (597 lines > 500); Large file: guardrails/async_guard.py (551 lines > 500)",
          "severity": "warn",
          "fix_hint": "Split the file into smaller modules grouped by concept, or add an\nexclusion in `.agent-readiness.toml` if the file is truly intentional\n(large generated tables, etc.).\n",
          "count": 11
        },
        {
          "pillar": "cognitive_load",
          "check_id": "git.churn_hotspots",
          "message": "5 findings \u2014 e.g. Hotspot: guardrails/guard.py changed 261 times and is >200 lines.; Hotspot: poetry.lock changed 230 times and is >200 lines.",
          "severity": "warn",
          "fix_hint": "For each hotspot, identify the dominant axes of change (e.g. one\nfile holds both API routing and validation logic) and split along\nthose lines. After the split, both halves see lower per-file churn.\n",
          "count": 5
        },
        {
          "pillar": "cognitive_load",
          "check_id": "agent_docs.canonical",
          "message": "None of these expected paths exist: AGENTS.md",
          "severity": "warn",
          "fix_hint": "Add an AGENTS.md to the repo root with: canonical commands\n(install/test/lint/run), a do-not-touch list, and commit conventions.\nSee agent-readiness/AGENTS.md for an example.\n",
          "count": 1
        },
        {
          "pillar": "cognitive_load",
          "check_id": "repo_shape.token_budget",
          "message": "Estimated orientation cost is ~36,446 tokens \u2014 may exceed agent context window.",
          "severity": "warn",
          "fix_hint": "Trim AGENTS.md / README to the essentials and split monolithic\nmodules so the largest representative source file is < 500 lines.\nThe orientation budget is fixed; the only variable is how much\nsignal you fit into it.\n",
          "count": 1
        },
        {
          "pillar": "feedback",
          "check_id": "deploy.smoke_check",
          "message": "A deploy step is configured but no workflow performs a post-deploy\nsmoke check (HTTP probe, Playwright/Cypress/Puppeteer, or Lighthouse).\n",
          "severity": "warn",
          "fix_hint": "After the deploy step (or in a separate `workflow_run` workflow),\nadd a smoke check that hits the deployed URL and fails on non-2xx\nor on a missing expected marker. Minimum useful version:\n\n    - name: Smoke check deployed site\n      run: |\n        set -euo pipefail\n        base=\"${{ steps.deployment.outputs.page_url }}\"\n        curl -fsSL \"$base\" | grep -q '<div id=\"root\"></div>'\n        curl -fsS  -o /dev/null -w '%{http_code}\\n' \"${base}data/healthz.json\"\n\nFor SPA-on-Pages projects, also probe a deep route to verify the\n404 fallback redirects to a valid hash route.\n",
          "count": 1
        }
      ],
      "scanned_at": "2026-05-02T04:40:04.397586+00:00",
      "rank": 2
    },
    {
      "repo": "huggingface/smolagents",
      "name": "smolagents",
      "owner": "huggingface",
      "description": "\ud83e\udd17 smolagents: a barebones library for agents that think in code.",
      "stars": 27033,
      "forks": 2539,
      "language": "Python",
      "url": "https://github.com/huggingface/smolagents",
      "avatar": "https://avatars.githubusercontent.com/u/25720743?v=4",
      "topics": [],
      "overall_score": 93.7,
      "grade": "S",
      "pillars": {
        "cognitive_load": 85.8,
        "feedback": 97.9,
        "flow": 96.1,
        "safety": 100.0
      },
      "top_findings": [
        {
          "pillar": "cognitive_load",
          "check_id": "repo_shape.large_files",
          "message": "14 findings \u2014 e.g. Large file: docs/source/ko/guided_tour.md (613 lines > 500); Large file: docs/source/en/guided_tour.md (652 lines > 500)",
          "severity": "warn",
          "fix_hint": "Split the file into smaller modules grouped by concept, or add an\nexclusion in `.agent-readiness.toml` if the file is truly intentional\n(large generated tables, etc.).\n",
          "count": 14
        },
        {
          "pillar": "cognitive_load",
          "check_id": "git.churn_hotspots",
          "message": "5 findings \u2014 e.g. Hotspot: src/smolagents/agents.py changed 193 times and is >200 lines.; Hotspot: src/smolagents/models.py changed 155 times and is >200 lines.",
          "severity": "warn",
          "fix_hint": "For each hotspot, identify the dominant axes of change (e.g. one\nfile holds both API routing and validation logic) and split along\nthose lines. After the split, both halves see lower per-file churn.\n",
          "count": 5
        },
        {
          "pillar": "cognitive_load",
          "check_id": "readme.has_run_instructions",
          "message": "README is missing signals for: test.",
          "severity": "warn",
          "fix_hint": "Add three short sections to README: Install (one fenced block),\nRun (one fenced block showing the canonical entry point), Test\n(one fenced block). Three fenced blocks is the floor; if your\nproject genuinely needs more, write more.\n",
          "count": 1
        },
        {
          "pillar": "cognitive_load",
          "check_id": "repo_shape.token_budget",
          "message": "Estimated orientation cost is ~84,676 tokens \u2014 may exceed agent context window.",
          "severity": "warn",